{
  "schemaVersion": "1.0",
  "exportId": "export_case_000421_a",
  "caseId": "case_000421",
  "caseType": "GENERAL",
  "initiatedByUserId": "usr_staff_example",
  "mode": "DUMP",
  "analysisPermission": "INCLUDED",
  "messageCount": 1,
  "cursor": null,
  "files": [
    {
      "path": "case_000421/messages.json",
      "mediaType": "application/json",
      "sha256": "bbbbbbbbbbbbbbbbbbbbbbbbbbbbbbbbbbbbbbbbbbbbbbbbbbbbbbbbbbbbbbbb"
    }
  ],
  "createdAt": "2026-07-03T11:00:00+08:00",
  "completedAt": "2026-07-03T11:01:00+08:00"
}
