[
  {
    "schemaVersion": "1.0",
    "exportId": "export_case_000421_dump",
    "caseId": "case_000421",
    "caseType": "GENERAL",
    "initiatedByUserId": "usr_staff_example",
    "mode": "DUMP",
    "analysisPermission": "INCLUDED",
    "messageCount": 4,
    "cursor": null,
    "files": [
      {
        "path": "case_000421/messages.json",
        "mediaType": "application/json",
        "sha256": "bbbbbbbbbbbbbbbbbbbbbbbbbbbbbbbbbbbbbbbbbbbbbbbbbbbbbbbbbbbbbbbb"
      },
      {
        "path": "case_000421/thread.md",
        "mediaType": "text/markdown",
        "sha256": "cccccccccccccccccccccccccccccccccccccccccccccccccccccccccccccccc"
      }
    ],
    "createdAt": "2026-07-03T11:00:00+08:00",
    "completedAt": "2026-07-03T11:01:00+08:00"
  },
  {
    "schemaVersion": "1.0",
    "exportId": "export_private_001_audit_only",
    "caseId": "case_private_001",
    "caseType": "PRIVATE_SUPPORT",
    "initiatedByUserId": "usr_staff_example",
    "mode": "DUMP",
    "analysisPermission": "EXCLUDED",
    "messageCount": 0,
    "cursor": null,
    "files": [
      {
        "path": "private_001/audit-manifest.json",
        "mediaType": "application/json",
        "sha256": "dddddddddddddddddddddddddddddddddddddddddddddddddddddddddddddddd"
      }
    ],
    "createdAt": "2026-07-03T12:00:00+08:00",
    "completedAt": "2026-07-03T12:00:01+08:00"
  }
]
